Document ID,Number,Content
WCPFC5,1,"The Fifth Regular Session of the Commission for the Conservation and Management of Highly Migratory Fish Stocks in the Western and Central Pacific Ocean (WCPFC5) took place from 8–12 December 2008 at Busan, Korea. The session was opened by the Chair of the Commission, Glenn Hurry (Australia)."
WCPFC5,2,"The following Members attended: Australia, Canada, People’s Republic of China, Cook Islands, European Community (EC), Federated States of Micronesia (FSM), Fiji, France, Japan, Kiribati, Korea, Republic of the Marshall Islands (RMI), Nauru, New Zealand, Niue, Palau, Papua New Guinea (PNG), Philippines, Samoa, Solomon Islands, Chinese Taipei, Tonga, Tuvalu, United States of America (USA) and Vanuatu."
WCPFC5,3,"Participating Territories that attended included American Samoa, Commonwealth of the Northern Mariana Islands, French Polynesia, Guam, New Caledonia and Tokelau."
WCPFC5,4,Indonesia and Belize participated as Cooperating Non-members (CNMs).
WCPFC5,5,"Observers from the following non-member countries attended: Ecuador, El Salvador, Mexico, Panama, Senegal, Thailand and Vietnam."
WCPFC5,6,"Observers from the following intergovernmental organizations attended: Inter-American Tropical Tuna Commission (IATTC), International Scientific Committee for Tunas and Tuna-like Species in the North Pacific Ocean (ISC), Pacific Islands Forum Fisheries Agency (FFA), Pacific Islands Forum Secretariat, and Secretariat of the Pacific Community (SPC).     2"
WCPFC5,7,"Observers from the following non-governmental organizations attended: American Fishermen’s Research Foundation, Birdlife International, Earth Island Institute (EII), Greenpeace, International Sustainable Seafood Foundation (ISSF), International Union for the Conservation of Nature (IUCN), Marine Stewardship Council (MSC), Pacific Island Tuna Industry Association, and World Wide Fund for Nature (WWF)."
WCPFC5,8,A full list of participants is provided in Attachment A.   1.1 Welcome address and Chair’s statement
WCPFC5,9,"An opening address was delivered by Park Deok-Bae, Vice Minister from the Korean Ministry for Food, Agriculture, Forestry and Fisheries (MIFAFF) (Attachment B). Samoa, on behalf of Commission members, thanked the host country for its hospitality."
WCPFC5,10,"The Chair made an opening statement (Attachment C), highlighting four key items before the Commission at WCPFC5, including a conservation and management measure (CMM) for bigeye and yellowfin tuna, a CMM for transhipment, compatible measures between exclusive economic zones (EEZs) and the high seas, and decisions on the application process for CNMs.   1.2 Adoption of agenda"
WCPFC5,11,The Commission adopted the agenda contained in WCPFC5-2008/03 Rev.3 and the provisional schedule of work contained in WCPFC5-2008/04 Rev.4.  1.3 Meeting arrangements
WCPFC5,12,"The WCPFC Executive Director, Andrew Wright, introduced Secretariat technical staff attending the meeting, including Andrew Richards, Compliance Manager; Ken Smithson, Finance and Administrative Officer; SungKwon Soh, Science Manager; Karl Staisch, Observer Programme Coordinator; and Ziro Suzuki, Japan Trust Fund Coordinator. In addition to Secretariat staff, Shelley Clarke served as rapporteur; Campbell Davies, Iain Hayes and Graeme Parkes participated as technical advisors on various subjects; and Martin Tsamenyi attended the meeting as the legal advisor. Herolyn Movick and Lucille Martinez of the WCPFC Secretariat, supported by Jeanny Relations (Busan), handled administrative arrangements.   AGENDA  ITEM  2  -  MEMBERSHIP   2.1 Status of the Convention"
WCPFC5,13,"The depository for the Convention, New Zealand, presented WCPFC5-2008/07, summarizing the status of the Convention as of 10 November 2008. New Zealand noted that since its last report at WCPFC4, it has not received notification of any instruments of ratification of or accession to the Convention.   2.2 Applications for Observer status"
WCPFC5,14,"Observer status was granted to the following four new applicants: Liberia,Vietnam,  International Sustainable Seafood Foundation, and the International Union for the Conservation of Nature (IUCN).   3  2.3 Applications for Cooperating Non-member status"
WCPFC5,15,"The Commission considered applications from Belize and Indonesia for the renewal of their CNM status, and new applications from Ecuador, El Salvador, Mexico and Senegal.  Documentation supporting these applications was distributed to delegations as WCPFC5-2008/08, and a summary of these materials was provided as WCPFC5-2008/IP10."
WCPFC5,16,Indonesia presented a statement summarizing its application for renewal of its CNM status for 2009 (Attachment D).
WCPFC5,17,WCPFC5 approved Indonesia’s application for CNM status for 2009.
WCPFC5,18,Belize presented a statement summarising its application for renewal of its CNM status for 2009 (Attachment E).
WCPFC5,19,"Some CCMs, while not opposing Belize’s application, expressed concern about the beneficial ownership of some fishing vessels flagged to Belize and currently operating in the WCPF Convention Area, and the extent to which Belize could exercise control over its vessels, and currently operating in the WCPF Convention Area. One member noted the relevance of “real interest” and the need to ensure that States are not able to come into the region, fish in an illegal, unreported and unregulated (IUU) fashion, and then claim CNM status. Concern was expressed that the failure of other regional fisheries management organizations (RFMOs) was leading to an increase in capacity in the WCPFC region, and that only applicants that could demonstrate a past presence in the region should receive CNM status. It was incumbent on the Commission to place limits, in line with those of past efforts, and accept applicants but limit capacity effort."
WCPFC5,20,"Belize asked that the focus remain on the compliance record of the beneficial owner, not simply the State from which the beneficial owner operates. Belize also noted the desirability of maintaining consistent standards with regard to beneficial ownership for both members and CNMs."
WCPFC5,21,"Other Cooperating Non-members and participating Territories (CCMs) fully supported Belize’s application, acknowledging its record of compliance with CMMs developed by the WCPFC and information requests over the past year."
WCPFC5,22,"In response to Belize’s stated intention to seek full membership in the Commission, some FFA members noted that the granting of CNM status should not be viewed as conferment of a right to become a Commission Member, or to seek an allocation that could lead to overcapacity and overfishing. Clarification was also sought as to whether ratification of, or accession to, the United Nations Convention on the Law of the Sea (UNCLOS) and the UN Fish Stocks Agreement  (UNFSA)  should be necessary requirements for CNM status."
WCPFC5,23,"Martin Tsamenyi explained that CMM 2004-02 does not require ratification of, or accession to, the UNCLOS or UNFSA as prerequisites for CNM status. He noted that there are some Commission Members who are not parties to both treaties.    4"
WCPFC5,24,"Some FFA members stated their support for CNM applications, which provide opportunities for small island developing State (SIDS) members of the Commission and participating territories to maximize economic benefits from the sustainable management of the tuna resources in the Convention Area."
WCPFC5,25,"WCPFC5 approved Belize’s application for CNM status for 2009, with the understanding that Belize will cooperate with WCPFC Members in the monitoring and control of its longline vessels."
WCPFC5,26,"The Chair noted that Belize had written to contracting parties requesting an invitation to accede to the Convention, and asked the Executive Director to progress this matter inter-sessionally."
WCPFC5,27,"El Salvador presented a statement supporting its application for CNM status (Attachment F). El Salvador committed to limiting its fishing in the Convention Area to two vessels that were granted licenses to fish in Kiribati’s EEZ, although El Salvador noted an interest in entering into further licensing arrangements with coastal State Commission Members should such opportunities become available under the vessel day scheme (VDS)."
WCPFC5,28,"Representatives of the FFA Secretariat and Kiribati stated that the two El Salvadorean vessels fishing in Kiribati’s EEZ in 2008 complied with vessel monitoring system (VMS) requirements for part of the time: one vessel reported from July to the present, and the other reported in April–May and in October–November. It was noted that reporting began in April 2008 because up until that time, these vessels were not on the WCPFC Record of Vessels and, thus, could not be entered into the FFA vessel registry."
WCPFC5,29,"In response to a request for clarification, Martin Tsamenyi explained that, under CMM 2004-01, Commission Members have agreed not to license non-members of the Commission or CNMs to fish in the Convention Area. Therefore, unless CMM 2004-01 is amended, coastal State Commission Members would be in violation of CMM 2004-01 if they license non-CCMs to fish in their EEZs."
WCPFC5,30,"In response to a question regarding its accession to UNCLOS and UNFSA, El Salvador responded that its accession was complicated by domestic legal issues but that its status with regard to these treaties notwithstanding, its intention in applying for CNM status was to comply with all applicable WCPFC CMMs."
WCPFC5,31,"With regard to El Salvador’s history of fishing on the high seas in the Convention Area in 2001–2004, 29 days of fishing had been recorded in the data available to the Commission."
WCPFC5,32,"Following reaffirmation from El Salvador that it would operate only two purse seiners in the WCPF Convention Area, and that its operations on the high seas would be in accordance with existing CMMs adopted by the Commission, WCPFC5 approved El Salvador’s application for CNM status for 2009."
WCPFC5,33,"Ecuador, Senegal and Mexico presented statements supporting their applications for CNM status (Attachments G, H and I)."
WCPFC5,34,"It was agreed that these three applications would be evaluated against a flowchart, based on CMM 2004-02, developed at Fourth Regular Session of the Technical and  5 Compliance Committee (TCC4 Summary Report, Attachment I) by a small group consisting of representatives from the USA and PNG. In addition to applying the flowchart to the applications, the USA and PNG co-facilitators met with applicants to clarify any outstanding issues; to confirm their understanding of how CMMs will apply to their existing or proposed fishing activities; and to explore whether each applicant was proposing any voluntary agreements to limit its catch or effort in the Convention Area given the status of the stocks."
WCPFC5,35,"Regarding Ecuador, the USA and PNG found that the application generally met the criteria for CNM status, but that there remained issues regarding the provision of operational data. In particular, due to gaps in the VMS record for seven Ecuadorean vessels fishing under license to Kiribati, there were questions regarding whether the operations of all of these vessels were conducted wholly within Kiribati’s national waters. It was noted that at WCPFC4, Kiribati committed to including a requirement for the Ecuadorean vessels to refrain from fishing on the high seas as a condition on their licenses."
WCPFC5,36,"In addition to the concerns raised by the group about possible unauthorized fishing on the high seas of the Convention Area by Ecuador over the past year, the USA stated that the historical data provided by Ecuador in support of its CNM application, indicated that there had been illegal operations conducted in the USA’s EEZ.  In addition, the USA stated that it has sought information and cooperation from Ecuador over the past 18 months regarding additional illegal fishing activity by Ecuadorian-flagged vessels in the USA EEZ and in other Member’s national waters. Despite attempts to settle this issue with Ecuadorean representatives, the USA noted that its concerns remain unresolved and, thus, it could not support Ecuador’s application."
WCPFC5,37,Ecuador responded that it is investigating the issues raised by the USA through its own internal procedures. A legal opinion has been sought from the Ecuadorian Attorney General and matters cannot proceed until this opinion is provided.
WCPFC5,38,"Other CCMs agreed that if Ecuador fished in the Convention Area outside of Kiribati’s EEZ in 2008, then i) such operations were clearly unsanctioned by the Commission; ii) Ecuador’s application for CNM status should not be approved due to failure to demonstrate a favourable record of compliance with Convention provisions and WCPFC CMMs adopted under para 5 of CMM 2004-02; and iii) punitive measures should be considered."
WCPFC5,39,"Kiribati spoke in favour of Ecuador’s application, emphasizing the importance of the existing Ecuadorean licenses to its economy. Kiribati asserted that issues with implementation of the VMS are being handled by FFA and that reports from Kiribati’s observers on board two of the Ecuadorean vessels will be provided to the Commission. Kiribati stated that according to its understanding, the Ecuadorean vessels were not fishing on the high seas."
WCPFC5,40,"Tuvalu also expressed its support for Ecuador’s application. Tuvalu reminded the Commission that it will be necessary to enter into bilateral arrangements with countries such as Ecuador in order to develop its fishery and realize the economic benefits of that development.  Tuvalu therefore supported Ecuador’s application. As a further step, Tuvalu requested that CMM 2004-01 and CMM 2004-02 be amended to allow SIDS to license non-Members to fish in their national waters on the understanding that such fishing would comply with all WCPFC CMMs.    6"
WCPFC5,41,"WCPFC5 agreed to approve Ecuador’s CNM status for a one-year period beginning 15 February 2009, subject to the following conditions (WCPFC5-2008/IP15):    a. Ecuador is granted Cooperating Non-member status for 2009, contingent upon satisfactory resolution of the USA’s concerns over the provision of necessary information relating to alleged violations in its EEZ. If Ecuador does not provide all requested information to the satisfaction of the USA by 15 February 2009, its Cooperating Non-member status will be null and void. If the USA’s concerns have been addressed by 15 February 2009, it will certify to the WCPFC Secretariat its satisfaction with the information provided.   b. The exemption granted to Kiribati at WCPFC4, allowing it to license fishing vessels from non-CCMs, will expire on 15 February 2009.   c. If Ecuador’s Cooperating Non-member status becomes null and void, Kiribati, Tuvalu and Nauru will be given an exemption for 2009 from CMM 2004-01 to allow seven Ecuadorian vessels to fish in waters under their national jurisdiction. It shall be a term and condition of the licenses for those vessels to fish in Kiribati, Tuvalu and Nauru waters that those vessels are not authorized to fish on the high seas of the Convention Area. In addition, this exemption is granted with the understanding that no other Ecuadorian-flagged vessels will fish on the high seas of the Convention Area. Such activities will be considered as undermining the intent and effectiveness of WCPFC conservation and management measures. d. Should Ecuador’s Cooperating Non-member status become effective, the following provisions would apply.   i. Ecuador commits that it will submit to high seas boardings and inspections in accordance with the Commission’s High Seas Boarding and Inspection procedures. ii. Noting that at the time of making the decision, the Commission had not received sufficient data to be able to confirm the applicable purse-seine days limit for Ecuador on the high seas for 2009. Consequently, Ecuador will be limited to zero days during 2009. The Commission noted that as soon as Ecuador provides to the WCPFC all relevant catch and effort data that would enable the WCPFC Secretariat to calculate and verify an applicable days limit pursuant to the new CMM for yellowfin tuna and bigeye tuna, this limit will be appropriately adjusted. If this is not able to be verified to the satisfaction of all members, Ecuador shall not fish on the high seas of the Convention Area in 2009. iii. Ecuador is willing and able to ensure full compliance by all its vessels with the conservation and management measures of the WCPFC and to respond to any alleged unauthorized activities by vessels flying its flag that have been brought to its attention.   iv. Ecuador commits to provide all fishery data required by the Commission in a timely manner.   v. Ecuador commits to comply with appropriate bilateral agreements and national laws and regulations of coastal States.   vi. Ecuador commits to have observers on board Ecuadorian-flagged vessels during all trips in the Convention Area, including high seas and EEZs.     7"
WCPFC5,42,"All CCMs and CNM applicants were reminded that because the official language of the Commission is English, all documents submitted to the Commission must be prepared in English, or accompanied by an English translation."
WCPFC5,43,"Regarding Senegal’s application for CNM status, the working group found that it met the criteria of CMM 2004-02."
WCPFC5,44,"Senegal committed to limiting its fishing activities in the WCPF Convention Area to one longline vessel, the Robaleira, which was fishing in 2005. This represents a reduction in Senegal’s fishing capacity in the Convention Area since 2007 when both the Robaleira and the Vieirasa fished in the Convention Area (WCPFC-2008/OP10 (Rev.1))."
WCPFC5,45,"One CCM questioned the data provided in Senegal’s supplemental documentation, in particular the very high catches of skipjack reported by the Robaleira in 2006, and inconsistent ratios of reported swordfish to shark catches, and asked that this be examined and that the Commission revisit how the proposed measure on swordfish would apply to Senegal."
WCPFC5,46,"Noting the concern regarding the species composition of the catches reported by Senegal to the Commission in WCPFC5-2008/OP10 (Rev. 1), and Senegal’s commitment to limit fishing activity to one longline vessel, WCPFC5 agreed to grant CNM status to Senegal for 2009."
WCPFC5,47,"Regarding Mexico’s application for CNM status, the working group found that it met the criteria in CMM 2004-02."
WCPFC5,48,"Mexico committed to the following (WCPFC5-2008/OP06):  a. Submission of all data required by the Commission in a timely manner; b. Full participation in the Commission VMS programme; c. Applicable requirements pertaining to WCPFC observer programmes; d. Limiting its fishing effort to not more than six purse-seine vessels fishing only in the EEZs of WCPFC Members, in accordance with appropriate bilateral agreements and pursuant to the VDS; e. Ensuring there is no transfer of effort from the IATTC area into the WCPF Convention Area during any IATTC closures; f. Abiding by all of the WCPFC CMMs, consistent with the above and with all relevant rights and duties under international law; g. Full cooperation with WCPFC Members in the conservation and management of Pacific bluefin tuna; and h. Full cooperation with WCPFC Members, particularly with SIDS."
WCPFC5,49,"Chinese Taipei and Japan spoke in support of Mexico’s application, citing its long history of fishing and good record of compliance in other RFMOs."
WCPFC5,50,"In response to a question, Mexico clarified that it is not currently a party to any bilateral access agreements in the WCPF Convention Area, as it did not yet have CNM status, but that if its CNM application is successful it may consider such arrangements."
WCPFC5,51,"Noting a number of compliance commitments and a voluntary agreement to limit fishing effort to no more than six purse-seine vessels fishing only in waters under  8 national jurisdiction of EEZs of WCPFC members, WCPFC5 agreed to grant CNM status to Mexico for 2009.    AGENDA  ITEM  3  -  MEMBER STATEMENTS 3.1 Statements by CCMs"
WCPFC5,52,"French Polynesia formally offered to host the Sixth Regular Session of WCPFC (WCPFC6) in Tahiti (Attachment J). Statements were also made by Kiribati, New Caledonia, Chinese Taipei, Palau (on behalf of FFA members), Tokelau, FSM and the Philippines. These statements are contained in Attachments K through Q.   AGENDA  ITEM  4  -  SCIENCE ISSUES 4.1 Report of the Fourth Regular Session of the Scientific Committee"
WCPFC5,53,"The Chair of the Scientific Committee (Dae-Yeon Moon, Korea) presented the summary outcomes of the Fourth Regular Session of the Scientific Committee (SC4) held in Port Moresby, Papua New Guinea from 11–22 August 2008."
WCPFC5,54,"The matters considered by the Scientific Committee (SC) and its six Specialist Working Groups included: • a review of the fisheries in the western and central Pacific Ocean (WCPO) and the eastern Pacific Ocean (EPO); • a review of stock status of bigeye tuna, skipjack tuna and southern albacore in the Convention Area; swordfish and striped marlin stocks in the South Pacific; and northern area stocks, including albacore, Pacific bluefin tuna, striped marlin and swordfish; • a review of a research proposal on Pacific-wide bigeye tuna biology, and a project report on reference points and management strategy evaluation (MSE); • bycatch mitigation issues and ecological risk assessment (ERA);  • issues associated with data available to the Commission and initiatives to address data gaps, the status of the Indonesia and Philippines Data Collection Project, and the Pacific Tuna Tagging Programme; • cooperation with other organizations; • the special requirements of SIDS and territories; • the process for developing the SC work programme and the 2009–2011 SC work programme; and • administrative matters associated with the functioning of the SC."
WCPFC5,55,"John Hampton (SPC-Oceanic Fisheries Programme, SPC-OFP), Scientific Services Provider) made a presentation on the status of the stocks as discussed at SC4 in August 2008. This presentation highlighted that the latest stock assessments had determined that for yellowfin tuna, there is a relatively high possibility that overfishing is occurring and that there is a small probability that it is in an overfished state; for bigeye tuna overfishing is occurring in the WCPO with a high probability that both adult and total biomass are predicted to become over-fished at 2003–2006 levels of fishing mortality and long-term average levels of recruitment.    9"
WCPFC5,56,"In response to questions, John. Hampton made the following points:  a. Declines in the number of skipjack migrating toward the coast of Japan as reported by Japanese fishermen might be a cause for concern if they represent a range contraction. While Japanese data are used in assessments, most data derive from equatorial areas.   b. Above-average bigeye tuna recruitment since 1985 has allowed the stock to remain above maximum sustainable yield (MSY) levels despite high levels of fishing mortality.   c. Catch data for the purse-seine fishery may underestimate the actual catch of bigeye tuna by a substantial amount. If so, the results of the stock assessment would be more pessimistic, and a greater proportion of stock depletion would be attributed to the purse-seine fishery.   d. The recent assessment of South Pacific swordfish conducted by the Commonwealth Scientific and Industrial Research Organisation (CSIRO, Australia) and the National Institute of Water and Atmospheric Research (NIWA) in New Zealand focused on the southwestern portion (west of 180o) of the WCPO. Attempts were made to construct a model, including the south-central Pacific, however there were problems with this approach due to the relatively weak data available for the assessment for the south-central area.  There was also a suggestion of relatively low mixing of swordfish between the southwest and south-central areas.   e. Critical uncertainties in some bigeye tuna data remain, particularly estimates for the purse-seine and Indonesian and Philippines domestic fisheries. The regional observer programme and the Indonesia-Philippines Data Collection Project are expected to improve data quality.  f. Emerging evidence from IATTC tagging studies show limited movement of bigeye tuna from the EPO to the WCPF Convention Area, but movements of bigeye tuna from the Central Pacific are less well known. Although separation of the stock into the IATTC and WCPFC areas is problematic, it is still feasible to manage bigeye in the two areas separately. SPC and IATTC routinely discuss and compare stock assessments of bigeye tuna, including comparison with a Pacific-wide model.   g. The results of the southern swordfish assessment are based on data for the southwest areas and, thus, apply only to that portion of the stock.   h. SPC regularly produces statistics on the rate of bycatch and discards in the purse-seine fishery. The rate is generally low (<5%).   4.2 Review of transitional arrangements for science structure and function"
