Document ID,Number,Content
WCPFC5,57,Graeme Parkes (Marine Resources Assessment Group – MRAG) presented a report on the Independent Review of the Commission’s Transitional Science Structure and Functions (WCPFC5-2008/11). The review encompassed an evaluation of scientific data and information functions; science functions; and institutional analysis. A number of recommendations were made with regard to data submission; data management and confidentiality; data custodianship services; contracting of research; standards for contracted research; conflicts of interest; cost effectiveness of contracted research; presentation of CCM research at the SC; review of ISC assessments; resourcing in the Secretariat; the relationship between the SC and the ISC; and organization of the SC.     10
WCPFC5,58,"In discussion, one CCM raised the need to provide a quantitative cost comparison of various options for data custodianship, and expressed a desire to see a quantitative evaluation of the performance of different RFMO models for research, assessment and data analysis."
WCPFC5,59,"Another CCM reiterated concerns about one of the issues presented in the report (i.e. the lack of access to background material, such as data and papers, used in the ISC assessments)."
WCPFC5,60,"Other CCMs suggested that the report could usefully elaborate on other issues, such as the need for economic and social data relating to fishing capacity; the potential for political interference in scientific work; and the possibility of reciprocal peer review arrangements between WCPFC and other RFMOs, in particular the IATTC."
WCPFC5,61,Concerns were raised that the report’s proposal to require that participants in SPC’s preparatory stock assessment workshops have scientific credentials may discriminate against FFA members.
WCPFC5,62,"Several CCMs made statements in support of the report and its proposals, including statements of appreciation for the high quality and cost-effective work of SPC as the WCPFC Science Services Provider. Many of these statements, however, suggested that the issues in the report should be discussed by the ISC, SC, Northern Committee (NC) and/or the Ad Hoc Task Group–Data before drawing any conclusions about the way forward."
WCPFC5,63,"WCPFC5 agreed that the Independent Review of the Commission’s Transitional Science Structure and Function:    a. Be finalized by the consultant following the receipt of any additional comments from CCMs by 1 March 2009; b. Be considered at the 2009 sessions of the ISC, SC, NC and/or Ad Hoc Task Group–Data; c. Be further considered at WCPFC6, taking into account the advice and recommendations of the ISC, SC, NC and/or Ad Hoc Task Group–Data."
WCPFC5,64,"In addition, WCPFC5 requested:  a. CCMs to actively work toward removing domestic barriers to data submission; b. The Secretariat work with ISC, SPC-OFP and relevant CCMs to develop a strategy for the incorporation of ISC data into the Commission’s data holdings; and  c. The Secretariat prepare for consideration of the 2009 sessions of the ISC, NC and Commission, a proposal that would support the periodic peer review of ISC and SC stock assessments. 4.3 Reference points"
WCPFC5,65,"Campbell Davies (CSIRO) presented work designed to identify the potential costs, benefits and difficulties of alternative approaches for identification of appropriate reference points within the WCPO (WCPFC5-2008/12). The presentation covered the  11 background to reference points, decision rules and risk; default reference points for WCPFC; and management strategy evaluation."
WCPFC5,66,"Work programme recommendations presented in the paper included:    • A small technical workshop (or discussion paper) to consider the technical definition of alternative limit reference points and make specific recommendations to SC and WCPFC6 on the range of potential reference points;  • Single- and multi-species case studies using short-term constant catch projections and current assessment models (southern swordfish or albacore and the tropical tuna species mix, respectively, were recommended);  • A capacity building workshop(s) for CCMs on reference points and MSE convened as a special workshop under the Methods Working Group at SC5.   • A management objectives workshop for discussion and recommendations to the Commission on technical interpretation and specification of fisheries management objectives."
WCPFC5,67,Several CCMs stated their strong support for articulation of the Commission’s fisheries management objectives and the development of reference points as tools for effective implementation of these objectives.
WCPFC5,68,"Some of these CCMs, in addition to stating their general support for ongoing work, expressed a desire for more capacity building and a more inclusive and collaborative approach to development of WCPFC management objectives and reference points. It was acknowledged that it would take time for all parties to gain a detailed understanding of the issues."
WCPFC5,69,The Commission agreed that SC5 should convene a seminar under the Methods Working Group on technical issues associated with reference points.
WCPFC5,70,The Commission agreed that WCPFC6 should consider the possibility of holding a dedicated workshop on management objectives in 2010.   4.4 Allocation
WCPFC5,71,"The Chair introduced a paper on allocation (WCPFC5-2008/20), reminding the Commission that this issue was raised at WCPFC3, but following limited discussion at WCPFC4, it was deferred to WCPFC5."
WCPFC5,72,"Several CCMs, including FFA members, noted that although allocation issues are important, work on these issues is not a high priority task for the Commission at present. It was considered that discussion of allocation would be best conducted as a component of an overall strategic management plan once management objectives, reference points and total allowable catch (TAC) and/or total allowable effort (TAE) are identified and agreed on by the Commission."
WCPFC5,73,"Some CCMs representing FFA members clarified that long-term management of the resources in their EEZs is now being undertaken through the VDS, and that allocations in EEZs are decided upon by the coastal States.     12"
WCPFC5,74,"The Commission agreed that consideration of allocation issues should be merged with the Commission’s consideration of management objectives and reference points. Therefore, discussions of allocation issues at WCPFC6 will be guided by the outcomes of work on reference points and management objectives by SC5 and TCC5.   4.5 Issues from the SC4 Summary Report"
WCPFC5,75,"The Chair of the SC presented the following new recommendations of SC4 with regard to key stocks of highly migratory species in the region:  a. For WCPO bigeye tuna, a minimum 30% reduction in fishing mortality from the average levels for 2003–2006 was recommended, with the goal of returning the fishing mortality rate to FMSY. Additional reductions will be required in fishing mortality in the future if assessments indicate that fishing mortality is greater than FMSY (SC4 Summary Report, para 143); b. For WCPO skipjack tuna, the high recent catches are considered to be sustainable unless recruitment falls persistently below the long-term average (SC4 Summary Report, para 150); c. For South Pacific albacore, catches should remain at current levels (SC4 Summary Report, para 154); d. For South Pacific swordfish, due to the uncertainty in the assessment, no further increase in catch or effort was recommended (SC4 Summary Report, para 161);  e. For Pacific bluefin tuna, it was recommended that there be no further increase in fishing mortality from the current level (SC4 Summary Report, para 171); and f. For North Pacific striped marlin, the fishing mortality rate should be reduced from the current level (to 2003 or before) (SC4 Summary Report, para 188)."
WCPFC5,76,"WCPFC5 adopted the recommendations of SC4 regarding bigeye tuna, skipjack tuna, South Pacific albacore, South Pacific swordfish, Pacific bluefin tuna and North Pacific striped marlin."
WCPFC5,77,"Other SC4 recommendations provided in the SC4 Summary Report and presented to WCPFC5 included:  a. Seabirds (para 213); b. Sharks (paras 215, 218 and 220); c. Small tuna on floating objects (para 223); d. Sea turtles (para 227); e. Ecological risk assessment (para 247); f. Data gaps (paras 253 and 257); g. Catch sampling (paras 264 and 265); h. Seabird mortality (para 268); i. Data elements of the Regional Observer Programme (para 272); and j. Data confidentiality, security and dissemination (paras 295 and 296)."
WCPFC5,78,"WCPFC5 adopted the recommendations of SC4 regarding bycatch mitigation and data and information, noting that several of these recommendations will be addressed in CMMs currently under discussion at WCPFC5.     13 4.6 Programme of work for the Scientific Committee in 2009, 2010 and 2011"
WCPFC5,79,"The Chair of the SC presented the recommendations of SC4 with regard to its proposed programme of work for 2009–2011 (SC4 Summary Report, paras 314–324). This programme includes:    a. The Indonesia and Philippines Data Collection Project (IPDCP); b. Publication and distribution of the Commission’s training and educational materials; c. Refinement of bigeye tuna parameters Pacific-wide: A comprehensive review and study of bigeye tuna reproductive biology; d. Regional study of the stock structure and life history characteristics of South Pacific albacore; e. Pacific-wide tagging project; f. Use underwater videos and other tools to characterize species, size composition and spatial distribution of tunas aggregating around floating objects; g. A technical workshop to consider suitability of MSY-based reference points as default limit reference points and how they may be operationalized; h. Collection and evaluation of purse-seine species composition data; and  i. North Pacific striped marlin mitigation methods."
WCPFC5,80,"The Chair noted that the proposed expenditure has grown from US$ 745,000 last year to US$ 795,000 this year, an increase of 6%. Nevertheless, this amount represents less than 0.02% of the estimated US$ 4 billion value of the fishery."
WCPFC5,81,"FFA members reiterated their concern that holding a workshop on reference points in 2009 would be premature. Therefore, in accordance with WCPFC5 agreements under Section 4.3 above, the technical workshop on reference points (g, above) will be replaced with a seminar on the same topic at SC5, and a possible workshop on management objectives in 2010."
WCPFC5,82,"PNG drew attention to its contribution of US$ 100,000 to the scientific work of the WCPFC, stating that this funding should not be used to fund work on reference points. Rather, it should be allocated to tuna tagging and to supporting SIDS participation in technical workshops."
WCPFC5,83,"In response to a question regarding item h above, in particular how the sampling objectives and designs will be determined, the Executive Director indicated that sampling at ports will be conducted in American Samoa (Pago Pago), FSM (Pohnpei), RMI (Majuro), Solomon Islands (Honiara), PNG (Wewak and Madang), Indonesia and the Philippines. John Hampton (SPC, Science Services Provider) explained that the research would focus on onboard sampling by observers, specifically to address concerns regarding purse-seine catches, which are sorted on board before transhipment."
WCPFC5,84,One CCM requested bigeye and yellowfin tuna stock assessments be conducted every year in order to support ongoing management efforts.
WCPFC5,85,"Another CCM noted with appreciation the Commission’s efforts to move toward a more strategic approach to its research planning, thereby allowing it to anticipate issues that will require focused scientific input.     14"
WCPFC5,86,WCPFC5 adopted the report of SC4 and thanked outgoing Chair Dae-Yeon Moon for his dedicated efforts to progress the work of the Scientific Committee over the past three years.   AGENDA  ITEM  5  -  NORTHERN COMMITTEE 5.1 Report of the Fourth Regular Session of the Northern Committee
WCPFC5,87,"The Chair of the Northern Committee, Masanori Miyahara (Japan), summarized the outcomes of the Fourth Regular Session of the Northern Committee (NC4), which met in Tokyo, Japan, 11–13 September 2008. NC4 considered the advice received from the 8th meeting of the ISC and the status of northern stocks. The report of the NC4 included reference to:   • the NC’s establishment of an interim management objective for North Pacific albacore;  • the NC’s recommended CMM for Pacific bluefin tuna, contingent on Korea lifting its reservation;  • the progress of the NC Working Group (WG) on striped marlin, and the NC'’ recommendations regarding the work of the WG;  • the NC’s recommendation regarding large-scale driftnets on the high seas in the Convention Area;  • the NC’s consideration of improvements to the North Pacific albacore CMM, which it plans to revisit at NC5."
WCPFC5,88,The management recommendation for North Pacific albacore is that fishing mortality should not be increased.
WCPFC5,89,"The recommendations for Pacific bluefin tuna are:    • That the current level of fishing mortality not be increased; • If fishing mortality remains at the current level and environmental conditions remain favorable, then recruitment should be sufficient to maintain current yields well into the future; and  • Increases in fishing mortality above the current level, and/or unfavorable changes in environmental conditions, may result in recruitment levels that are insufficient to sustain the current productivity of the stock."
WCPFC5,90,"Although scientific advice regarding northern striped marlin was provided to the NC by the ISC, there has not yet been a recommendation by the SC that northern striped marlin is a northern stock, therefore no management advice was proposed."
WCPFC5,91,The NC noted the importance of ensuring that any reductions on fishing effort resulting from the CMM for bigeye and yellowfin tuna not be transferred to northern stocks.
WCPFC5,92,The NC expressed its support for amending the CMM for sharks (CMM 2006-05) to apply to all vessel sizes.   15    5.2 Issues from the NC4 Report
WCPFC5,93,"The NC Chair explained that Korea had entered a reservation to the management recommendation for Pacific bluefin tuna. The reasons for this reservation have been thoroughly explored with Korea, which has indicated it has no intention to increase its effort in 2009."
WCPFC5,94,"Korea stated that it is requesting a postponement, during which it will work to improve a statistical system on the northern Pacific bluefin tuna, study the distribution of Pacific bluefin in its coastal waters, and explore mechanisms for controlling effort given existing national laws and regulations."
WCPFC5,95,"Given Korea’s reservation, the Chair of the NC suggested that Commission Members may wish to implement the recommendation on a voluntary basis and report their efforts in this regard to NC5. The recommendation can be reconsidered by NC5 and potentially developed into a draft CMM to be considered at WCPFC6. In 2009, the Chair of the NC will meet with representatives of Mexico to begin a dialogue on cooperative Pacific bluefin tuna management."
WCPFC5,96,One CCM expressed concern that the management recommendation for Pacific bluefin:  i) is not adequately precautionary; ii) is premised on an assumption that environmental conditions remain favorable; and iii) does not define current effort.
WCPFC5,97,"Gary Sakagawa, Chair of the ISC, informed the Commission that the ISC is currently holding a workshop designed to clarify points of uncertainty in the Pacific bluefin stock assessment. More informative scientific advice is expected to be available for WCPFC6."
WCPFC5,98,"Two CCMs expressed their concerns about the status of the Pacific bluefin stock, urging the ISC and the NC to work toward a revised management recommendation next year."
WCPFC5,99,"WCPFC5 agreed that CCMs are requested not to increase the level of fishing mortality on Pacific bluefin in 2009 on a voluntary basis and tasked the NC to work toward developing a draft CMM for Pacific bluefin for consideration at WCPFC6.   5.3 Programme of work for the Northern Committee in 2009, 2010, 2011"
WCPFC5,100,"The NC Chair presented the NC work programme for 2009–2011, which outlines projects under four main headings: northern stocks; non-target, associated and dependent species; review of the effectiveness of decisions; and cooperation with other organizations (Report of the NC4, Attachment L)."
WCPFC5,101,"The Chair noted that an interim management objective for North Pacific albacore was established, which states that spawning stock biomass should be maintained above the level represented by the average of the lowest 10 years in the stock’s 40-year data history. The NC plans to consider the need for management action in 2009, and anticipates a new stock assessment from the ISC in 2010."
WCPFC5,102,The work programme for Pacific bluefin tuna is referred to in Section 5.2 above.  16
WCPFC5,103,A stock assessment for North Pacific swordfish is expected in 2009.
WCPFC5,104,One CCM expressed concern that the interim management objective for North Pacific albacore is not sufficiently precautionary. Clarification was requested as to how this objective relates to levels of un-fished biomass.
WCPFC5,105,Representatives of the NC and the ISC responded that the interim management objective is simply designed to prevent the stock from falling below its lowest documented levels. Work to develop more permanent fisheries management reference points is ongoing and will inform future evaluation of stock status and formulation of conservation and management recommendations.
WCPFC5,106,"The issue of the NC’s inability to propose a management measure for North Pacific striped marlin in the absence of its designation as a northern stock was raised. However, it was noted that a North Pacific striped marlin management recommendation was agreed on as part of the adoption of the report of SC4."
WCPFC5,107,WCPFC adopted the NC4 Summary Report.    AGENDA  ITEM  6  -  TECHNICAL AND COMPLIANCE COMMITTEE 6.1 Report of the Fourth Regular Session of the Technical and Compliance Committee
WCPFC5,108,"Wendell Sanford (Canada), Chair of the TCC, presented the outcomes of TCC4, which was held in Pohnpei, FSN, 2–7 October 2008. The following recommendations from the TCC4 Summary Report were adopted by the Commission:    a. TCC4 recommended to the Intersessional Working Group on the Regional Observer Programme (IWG-ROP) that crew nationality was not an essential data field, but that verification of fish hold capacity should be included as a data field for the ROP  (para 15);   b. TCC4 recommended that the Commission approve the collection of data listed in Attachment C to the TCC4 report (para 23).   c. TCC4 recommended to WCPFC5 that the mandate of the IWG-ROP be extended for a period of one year (para 34). d. TCC4 recommended to WCPFC5 that it authorize the IWG-ROP to continue its work on outstanding items contained in CMM 2006-07, a non-exhaustive list of which is attached at Attachment D to the TCC4 Summary Report (para 35).   e. TCC4 recommended that the Secretariats of the WCPFC and FFA enter into discussions with a view to preparing a draft VMS service level agreement for consideration by the Commission at WCPFC5 (para 40).   f. With respect to costs for the Commission VMS, TCC4 recommended to WCPFC5 that CCMs will assume costs for their vessels. Costs for Secretariat operations of the Commission VMS will be borne by the Commission budget (para 56).   g. TCC4 recommended to WCPFC5 that the activation date for the WCPFC VMS be 1 April 2009 (para 58).    17 h. Regarding TCC4’s discussions of para 3(j) of CMM-2007-03, the majority favored retaining this paragraph while the minority favored its removal. CCMs agreed to recommend to the Commission not to apply para 3(j) of CMM-2007-03 as a criterion for IUU listing in developing the Draft IUU Vessel List in 2009. During this period, the Secretariat, in consultation with interested CCMs, will develop additional procedures to give effect to this paragraph for discussion at TCC5 (para 115).    i. TCC4 recommended participation of CCMs and the WCPFC Secretariat in the Second Meeting of International Tuna RFMOs (para 118).   j. TCC4 recommended consideration of IUU lists developed in other RFMOs as a criterion in the development of the WCPFC IUU Vessel List. In doing so, WCPFC should take into account the processes used within other RFMOs and characteristics of the area for IUU listing (para 119).  k. TCC4 noted that in the future, the development and implementation of a measure in this Commission might be required to sanction CCMs that frequently have their vessels nominated for IUU listing, especially if any CCM fails to effectively monitor, control and sanction offending vessels and vessel operators. Noting this point, TCC4 suggested that any potential measure should take into account actions taken to impose sanctions in other RFMOs. TCC4 recommended that this issue be taken up by the Compliance with Conservation and Management Measures (CCMM) Working Group facilitated by Australia (para 121–123).   l. TCC4 recommended that WCPFC5 agree that for the purpose of the High Seas Boarding and Inspection Procedures, CCMs shall provide to the Secretariat the contact information for the authorities of their fishing vessels (para 167).   m. TCC4 recommended to WCPFC5 that the Secretariat, in consultation with CCMs, develop a web-based system for vessel record information (para 172).   n. TCC4 recommended to WCPFC5 that the exemption for non-CCM carrier and bunker vessels be extended for a further year (para 175).    o. TCC4 recommended to WCPFC5 that, depending on the response [of CCMs to a call to bring their reporting up to date in advance of WCPFC5] the Commission may wish to consider remedial action, including sanctions, for failure to comply (para 209).   p. TCC4 recommended to WCPFC5 that [the TCC4] budget and work plan be approved (para 234).   q. TCC4 recommended deferral of the issue of port State measures for WCPFC until conclusion of the FAO process (para 246). r. TCC4 recommended to WCPFC5 that it should clarify that with respect to the seabird CMM, different measures must be taken from each column [of CMM 2007-04, Table 1: Mitigation Measures (for seabirds)] when weighted branch lines are under consideration (para 275). s. TCC4 discussed the technical specifications for seabird mitigation measures provided as Attachment O, Annex 1 and recommended to WCPFC5 that further review of these specifications should take place at SC5 and TCC5, drawing on the most recent decision by the Indian Ocean Tuna Commission (IOTC) on this matter (para 276)."
WCPFC5,109,"In response to a question regarding high seas boarding and inspection procedures, it was clarified that under para 6 of CMM 2006-08, these procedures apply between a Contracting Party and a Fishing Entity subject to a notification to that effect to the  18 Commission from the Contracting Party concerned. With regard to Chinese Taipei, the Secretariat reported receiving such notifications from New Zealand and Cook Islands."
WCPFC5,110,"Regarding the extension of the exemption for non-CCM carrier and bunker vessels for another year (item n above), FFA members stated that in some cases, such vessels are vital for continued operation of the fishery and that a more considered solution to this ongoing problem should be made a priority work item for TCC5."
WCPFC5,111,"It was noted that in order to be consistent with the respective roles and responsibilities of TCC4 and WCPFC5, the recommendation in paras 275 and 276 of the TCC4 report should read “recommended to WCPFC5”.  These changes have been incorporated into items r and s above.   6.2 VMS standards, specifications and procedures"
WCPFC5,112,"The Chair of the TCC presented the latest draft of the WCPFC VMS standards, specifications and procedures (SSPs) produced by TCC4 (WCPFC5-2008/16 Suppl.). Although the TCC4 draft was nearly complete, agreement was not reached on text in paras 5.3, 5.4, 5.5 and 7.3.6."
WCPFC5,113,"In response to comments from Chinese Taipei (WCPFC5-2008/DP-25) with respect to the application of procedures to contact vessels that fail to report at agreed intervals, it was agreed that the WCPFC Secretariat and the flag State will use all practical means, including radio from and to the flag State, to re-establish and maintain contact with the vessel in question."
WCPFC5,114,"In discussion of the text in para 5.3 of the SSPs, one CCM suggested that “before entry” be replaced with “upon entry” and “high seas of the” be inserted before “Convention Area is exited” in the second sentence."
WCPFC5,115,"Despite lengthy discussion, agreement on paras 5.4 and 5.5 of the SSPs could not be reached. CCMs’ views ranged from a desire to allow 30 days for re-establishing the functioning of a vessel’s automatic location communicator (ALC) with an 8-hour interim manual reporting interval in para 5.4 (15 days and 8 hours in para 5.5), to immediate return to port in the event of ALC malfunction with manual reporting every hour. Arguments were also made for a 10-day re-establishment limit with 4-hour manual reporting intervals. It was stated that other RFMOs have re-establishment limits of 30–60 days and that the FFA VMS requires manual reporting at 4-hour intervals."
